{
  "schema_version": "otb-weather-case-v1",
  "generated_at": "2026-07-09T00:00:00Z",
  "description": "Demo cases for the OTB Weather Resolver walkthrough. These are synthetic companion cases for demonstrating edge cases — unclear resolution due to incomplete data, and retrieval failure due to service outage. They are NOT part of the evaluation set.",
  "market_selection": {
    "project": "OTB walkthrough demo cases",
    "selection_notes": "Two synthetic cases mirroring the Tokyo low-temp market structure, but with deliberately broken/corrupted fixtures to demonstrate how observability aids debugging."
  },
  "markets": [
    {
      "case_id": "demo_unclear",
      "polymarket_url": "https://polymarket.com/event/demo-incomplete-data",
      "proposal_tx_hash": "0x0000000000000000000000000000000000000000000000000000000000000001",
      "question_data": {
        "question_id": "0x0000000000000000000000000000000000000000000000000000000000000001",
        "market_id": "9999991",
        "market_slug": "demo-unclear-incomplete-data",
        "gamma_slug": "demo-unclear-incomplete-data",
        "title": "Will the lowest temperature in Tokyo be 20°C on June 1?",
        "proposal_time": "2026-06-01T15:06:18Z",
        "processed_time": "2026-06-01T15:07:44Z",
        "end_date_iso": "2026-06-01T00:00:00Z",
        "resolution_conditions": "p1: No. p2: Yes. p3: 50/50 outcome. p4: Too Early.",
        "proposed_outcome": "p2",
        "outcomes": {
          "p1": "No",
          "p2": "Yes",
          "p3": "50/50 outcome",
          "p4": "Too Early"
        }
      },
      "ancillary_data": "q: title: Will the lowest temperature in Tokyo be 20°C on June 1?, description: This market will resolve to the temperature range that contains the lowest temperature recorded at the Tokyo Haneda Airport Station in degrees Celsius on 1 Jun '26.\n\nThe resolution source for this market will be information from Wunderground, specifically the lowest temperature recorded for all times on this day for the Tokyo Haneda Airport Station, available here: https://www.wunderground.com/history/daily/jp/tokyo/RJTT.\n\nTo toggle between Fahrenheit and Celsius, click the gear icon next to the search bar and switch the Temperature setting between °F and °C.\n\nThis market can not resolve until the first data point for the following date has been published on the resolution source.\n\nThe resolution source for this market measures temperatures to whole degrees Celsius (eg, 9°C). Thus, this is the level of precision that will be used when resolving the market.\n\nRevisions to temperatures recorded within this market's timeframe will be considered until the first datapoint for the following date has been published, after which any alterations will not be considered. market_id: 9999991 res_data: p1: 0, p2: 1, p3: 0.5. Where p1 corresponds to No, p2 to Yes, p3 to unknown. This request MUST only resolve to p1 or p2.  Updates made by the question creator via the bulletin board at 0x69c47De9D4D3Dad79590d61b9e05918E03775f24 should be considered.,initializer:f43d55f3a8b7484ed4b6931f93cb6f9ef5dd369d"
    }
  ]
}
